sudo tcpdump -n -i ens4



nop,nop,TS val 1840611640 ecr 3440941344], length 384
00:06:34.234638 IP 35.235.242.34.41723 > 10.188.0.2.22: Flags [.], ack 582976, win 5708, options [nop,nop,TS val 34
40941345 ecr 1840611633], length 0
00:06:34.234647 IP 10.188.0.2.22 > 35.235.242.34.41723: Flags [P.], seq 588672:588896, ack 1729, win 501, options [
nop,nop,TS val 1840611641 ecr 3440941345], length 224
00:06:34.234705 IP 10.188.0.2.22 > 35.235.242.34.41723: Flags [P.], seq 588896:589280, ack 1729, win 501, options [
nop,nop,TS val 1840611641 ecr 3440941345], length 384
00:06:34.235848 IP 35.235.242.34.41723 > 10.188.0.2.22: Flags [.], ack 583584, win 5708, options [nop,nop,TS val 34
40941346 ecr 1840611635], length 0
00:06:34.235856 IP 10.188.0.2.22 > 35.235.242.34.41723: Flags [P.], seq 589280:589504, ack 1729, win 501, options [
nop,nop,TS val 1840611642 ecr 3440941346], length 224
00:06:34.235920 IP 10.188.0.2.22 > 35.235.242.34.41723: Flags [P.], seq 589504:589888, ack 1729, win 501, options [
nop,nop,TS val 1840611642 ecr 3440941346], length 384
00:06:34.236027 IP 35.235.242.34.41723 > 10.188.0.2.22: Flags [.], ack 584192, win 5708, options [nop,nop,TS val 34
40941346 ecr 1840611635], length 0
00:06:34.236035 IP 10.188.0.2.22 > 35.235.242.34.41723: Flags [P.], seq 589888:590112, ack 1729, win 501, options [
nop,nop,TS val 1840611642 ecr 3440941346], length 224
00:06:34.236086 IP 10.188.0.2.22 > 35.235.242.34.41723: Flags [P.], seq 590112:590496, ack 1729, win 501, options [
nop,nop,TS val 1840611643 ecr 3440941346], length 384
00:06:34.236864 IP 35.235.242.34.41723 > 10.188.0.2.22: Flags [.], ack 584800, win 5708, options [nop,nop,TS val 34
40941347 ecr 1840611636], length 0
00:06:34.236873 IP 10.188.0.2.22 > 35.235.242.34.41723: Flags [P.], seq 590496:590720, ack 1729, win 501, options [
nop,nop,TS val 1840611643 ecr 3440941347], length 224
00:06:34.236934 IP 10.188.0.2.22 > 35.235.242.34.41723: Flags [P.], seq 590720:591104, ack 1729, win 501, options [
nop,nop,TS val 1840611643 ecr 3440941347], length 384
00:06:34.237137 IP 35.235.242.34.41723 > 10.188.0.2.22: Flags [.], ack 585408, win 5708, options [nop,nop,TS val 34
40941347 ecr 1840611636], length 0
00:06:34.237147 IP 10.188.0.2.22 > 35.235.242.34.41723: Flags [P.], seq 591104:591328, ack 1729, win 501, options [
nop,nop,TS val 1840611644 ecr 3440941347], length 224
00:06:34.237206 IP 10.188.0.2.22 > 35.235.242.34.41723: Flags [P.], seq 591328:591712, ack 1729, win 501, options [
nop,nop,TS val 1840611644 ecr 3440941347], length 384
00:06:34.238493 IP 10.188.0.2.22 > 35.235.242.34.41723: Flags [P.], seq 591712:591936, ack 1729, win 501, options [
nop,nop,TS val 1840611645 ecr 3440941347], length 224
00:06:34.238521 IP 35.235.242.34.41723 > 10.188.0.2.22: Flags [.], ack 586016, win 5708, options [nop,nop,TS val 34
40941349 ecr 1840611637], length 0
00:06:34.238645 IP 35.235.242.34.41723 > 10.188.0.2.22: Flags [.], ack 586624, win 5708, options [nop,nop,TS val 34
40941349 ecr 1840611637], length 0
00:06:34.238690 IP 10.188.0.2.22 > 35.235.242.34.41723: Flags [P.], seq 591936:592320, ack 1729, win 501, options [
nop,nop,TS val 1840611645 ecr 3440941349], length 384
00:06:34.239897 IP 35.235.242.34.41723 > 10.188.0.2.22: Flags [.], ack 587072, win 5708, options [nop,nop,TS val 34
40941350 ecr 1840611639], length 0
00:06:34.239922 IP 10.188.0.2.22 > 35.235.242.34.41723: Flags [P.], seq 592320:592704, ack 1729, win 501, options [
